{
  "schema": "agent-safe-bible.book.v1",
  "translation": "KJV",
  "id": "TIT",
  "name": "Titus",
  "chapters": [
    {
      "chapter": 1,
      "verses": [
        {
          "verse": 1,
          "text": "Paul, a servant of God, and an apostle of Jesus Christ, according to the faith of God’s elect, and the acknowledging of the truth which is after godliness;"
        },
        {
          "verse": 2,
          "text": "In hope of eternal life, which God, that cannot lie, promised before the world began;"
        },
        {
          "verse": 3,
          "text": "But hath in due times manifested his word through preaching, which is committed unto me according to the commandment of God our Saviour;"
        },
        {
          "verse": 4,
          "text": "To Titus, mine own son after the common faith: Grace, mercy, and peace, from God the Father and the Lord Jesus Christ our Saviour."
        },
        {
          "verse": 5,
          "text": "For this cause left I thee in Crete, that thou shouldest set in order the things that are wanting, and ordain elders in every city, as I had appointed thee:"
        },
        {
          "verse": 6,
          "text": "If any be blameless, the husband of one wife, having faithful children not accused of riot or unruly."
        },
        {
          "verse": 7,
          "text": "For a bishop must be blameless, as the steward of God; not selfwilled, not soon angry, not given to wine, no striker, not given to filthy lucre;"
        },
        {
          "verse": 8,
          "text": "But a lover of hospitality, a lover of good men, sober, just, holy, temperate;"
        },
        {
          "verse": 9,
          "text": "Holding fast the faithful word as he hath been taught, that he may be able by sound doctrine both to exhort and to convince the gainsayers."
        },
        {
          "verse": 10,
          "text": "For there are many unruly and vain talkers and deceivers, specially they of the circumcision:"
        },
        {
          "verse": 11,
          "text": "Whose mouths must be stopped, who subvert whole houses, teaching things which they ought not, for filthy lucre’s sake."
        },
        {
          "verse": 12,
          "text": "One of themselves, even a prophet of their own, said, The Cretians are alway liars, evil beasts, slow bellies."
        },
        {
          "verse": 13,
          "text": "This witness is true. Wherefore rebuke them sharply, that they may be sound in the faith;"
        },
        {
          "verse": 14,
          "text": "Not giving heed to Jewish fables, and commandments of men, that turn from the truth."
        },
        {
          "verse": 15,
          "text": "Unto the pure all things are pure: but unto them that are defiled and unbelieving is nothing pure; but even their mind and conscience is defiled."
        },
        {
          "verse": 16,
          "text": "They profess that they know God; but in works they deny him, being abominable, and disobedient, and unto every good work reprobate."
        }
      ]
    },
    {
      "chapter": 2,
      "verses": [
        {
          "verse": 1,
          "text": "But speak thou the things which become sound doctrine:"
        },
        {
          "verse": 2,
          "text": "That the aged men be sober, grave, temperate, sound in faith, in charity, in patience."
        },
        {
          "verse": 3,
          "text": "The aged women likewise, that they be in behaviour as becometh holiness, not false accusers, not given to much wine, teachers of good things;"
        },
        {
          "verse": 4,
          "text": "That they may teach the young women to be sober, to love their husbands, to love their children,"
        },
        {
          "verse": 5,
          "text": "To be discreet, chaste, keepers at home, good, obedient to their own husbands, that the word of God be not blasphemed."
        },
        {
          "verse": 6,
          "text": "Young men likewise exhort to be sober minded."
        },
        {
          "verse": 7,
          "text": "In all things shewing thyself a pattern of good works: in doctrine shewing uncorruptness, gravity, sincerity,"
        },
        {
          "verse": 8,
          "text": "Sound speech, that cannot be condemned; that he that is of the contrary part may be ashamed, having no evil thing to say of you."
        },
        {
          "verse": 9,
          "text": "Exhort servants to be obedient unto their own masters, and to please them well in all things; not answering again;"
        },
        {
          "verse": 10,
          "text": "Not purloining, but shewing all good fidelity; that they may adorn the doctrine of God our Saviour in all things."
        },
        {
          "verse": 11,
          "text": "For the grace of God that bringeth salvation hath appeared to all men,"
        },
        {
          "verse": 12,
          "text": "Teaching us that, denying ungodliness and worldly lusts, we should live soberly, righteously, and godly, in this present world;"
        },
        {
          "verse": 13,
          "text": "Looking for that blessed hope, and the glorious appearing of the great God and our Saviour Jesus Christ;"
        },
        {
          "verse": 14,
          "text": "Who gave himself for us, that he might redeem us from all iniquity, and purify unto himself a peculiar people, zealous of good works."
        },
        {
          "verse": 15,
          "text": "These things speak, and exhort, and rebuke with all authority. Let no man despise thee."
        }
      ]
    },
    {
      "chapter": 3,
      "verses": [
        {
          "verse": 1,
          "text": "Put them in mind to be subject to principalities and powers, to obey magistrates, to be ready to every good work,"
        },
        {
          "verse": 2,
          "text": "To speak evil of no man, to be no brawlers, but gentle, shewing all meekness unto all men."
        },
        {
          "verse": 3,
          "text": "For we ourselves also were sometimes foolish, disobedient, deceived, serving divers lusts and pleasures, living in malice and envy, hateful, and hating one another."
        },
        {
          "verse": 4,
          "text": "But after that the kindness and love of God our Saviour toward man appeared,"
        },
        {
          "verse": 5,
          "text": "Not by works of righteousness which we have done, but according to his mercy he saved us, by the washing of regeneration, and renewing of the Holy Ghost;"
        },
        {
          "verse": 6,
          "text": "Which he shed on us abundantly through Jesus Christ our Saviour;"
        },
        {
          "verse": 7,
          "text": "That being justified by his grace, we should be made heirs according to the hope of eternal life."
        },
        {
          "verse": 8,
          "text": "This is a faithful saying, and these things I will that thou affirm constantly, that they which have believed in God might be careful to maintain good works. These things are good and profitable unto men."
        },
        {
          "verse": 9,
          "text": "But avoid foolish questions, and genealogies, and contentions, and strivings about the law; for they are unprofitable and vain."
        },
        {
          "verse": 10,
          "text": "A man that is an heretick after the first and second admonition reject;"
        },
        {
          "verse": 11,
          "text": "Knowing that he that is such is subverted, and sinneth, being condemned of himself."
        },
        {
          "verse": 12,
          "text": "When I shall send Artemas unto thee, or Tychicus, be diligent to come unto me to Nicopolis: for I have determined there to winter."
        },
        {
          "verse": 13,
          "text": "Bring Zenas the lawyer and Apollos on their journey diligently, that nothing be wanting unto them."
        },
        {
          "verse": 14,
          "text": "And let ours also learn to maintain good works for necessary uses, that they be not unfruitful."
        },
        {
          "verse": 15,
          "text": "All that are with me salute thee. Greet them that love us in the faith. Grace be with you all. Amen."
        }
      ]
    }
  ]
}
