{
  "schema": "agent-safe-bible.book.v1",
  "translation": "WEB",
  "id": "HAG",
  "name": "Haggai",
  "chapters": [
    {
      "chapter": 1,
      "verses": [
        {
          "verse": 1,
          "text": "In the second year of Darius the king, in the sixth month, in the first day of the month, the LORD’s word came by Haggai the prophet, to Zerubbabel the son of Shealtiel, governor of Judah, and to Joshua the son of Jehozadak, the high priest, saying,"
        },
        {
          "verse": 2,
          "text": "“This is what the LORD of Armies says: These people say, ‘The time hasn’t yet come, the time for the LORD’s house to be built.’”"
        },
        {
          "verse": 3,
          "text": "Then the LORD’s word came by Haggai the prophet, saying,"
        },
        {
          "verse": 4,
          "text": "“Is it a time for you yourselves to dwell in your paneled houses, while this house lies waste?"
        },
        {
          "verse": 5,
          "text": "Now therefore this is what the LORD of Armies says: ‘Consider your ways."
        },
        {
          "verse": 6,
          "text": "You have sown much, and bring in little. You eat, but you don’t have enough. You drink, but you aren’t filled with drink. You clothe yourselves, but no one is warm; and he who earns wages earns wages to put them into a bag with holes in it.’"
        },
        {
          "verse": 7,
          "text": "“This is what the LORD of Armies says: ‘Consider your ways."
        },
        {
          "verse": 8,
          "text": "Go up to the mountain, bring wood, and build the house. I will take pleasure in it, and I will be glorified,” says the LORD."
        },
        {
          "verse": 9,
          "text": "“You looked for much, and, behold, it came to little; and when you brought it home, I blew it away. Why?” says the LORD of Armies, “Because of my house that lies waste, while each of you is busy with his own house."
        },
        {
          "verse": 10,
          "text": "Therefore for your sake the heavens withhold the dew, and the earth withholds its fruit."
        },
        {
          "verse": 11,
          "text": "I called for a drought on the land, on the mountains, on the grain, on the new wine, on the oil, on that which the ground produces, on men, on livestock, and on all the labor of the hands.”"
        },
        {
          "verse": 12,
          "text": "Then Zerubbabel the son of Shealtiel and Joshua the son of Jehozadak, the high priest, with all the remnant of the people, obeyed the LORD their God’s voice, and the words of Haggai the prophet, as the LORD their God had sent him; and the people feared the LORD."
        },
        {
          "verse": 13,
          "text": "Then Haggai, the LORD’s messenger, spoke the LORD’s message to the people, saying, “I am with you,” says the LORD."
        },
        {
          "verse": 14,
          "text": "The LORD stirred up the spirit of Zerubbabel the son of Shealtiel, governor of Judah, and the spirit of Joshua the son of Jehozadak, the high priest, and the spirit of all the remnant of the people; and they came and worked on the house of the LORD of Armies, their God,"
        },
        {
          "verse": 15,
          "text": "in the twenty-fourth day of the month, in the sixth month, in the second year of Darius the king."
        }
      ]
    },
    {
      "chapter": 2,
      "verses": [
        {
          "verse": 1,
          "text": "In the seventh month, in the twenty-first day of the month, the LORD’s word came by Haggai the prophet, saying,"
        },
        {
          "verse": 2,
          "text": "“Speak now to Zerubbabel the son of Shealtiel, governor of Judah, and to Joshua the son of Jehozadak, the high priest, and to the remnant of the people, saying,"
        },
        {
          "verse": 3,
          "text": "‘Who is left among you who saw this house in its former glory? How do you see it now? Isn’t it in your eyes as nothing?"
        },
        {
          "verse": 4,
          "text": "Yet now be strong, Zerubbabel,’ says the LORD. ‘Be strong, Joshua son of Jehozadak, the high priest. Be strong, all you people of the land,’ says the LORD, ‘and work, for I am with you,’ says the LORD of Armies."
        },
        {
          "verse": 5,
          "text": "This is the word that I covenanted with you when you came out of Egypt, and my Spirit lived among you. ‘Don’t be afraid.’"
        },
        {
          "verse": 6,
          "text": "For this is what the LORD of Armies says: ‘Yet once more, it is a little while, and I will shake the heavens, the earth, the sea, and the dry land;"
        },
        {
          "verse": 7,
          "text": "and I will shake all nations. The treasure of all nations will come, and I will fill this house with glory, says the LORD of Armies."
        },
        {
          "verse": 8,
          "text": "The silver is mine, and the gold is mine,’ says the LORD of Armies."
        },
        {
          "verse": 9,
          "text": "‘The latter glory of this house will be greater than the former,’ says the LORD of Armies; ‘and in this place I will give peace,’ says the LORD of Armies.”"
        },
        {
          "verse": 10,
          "text": "In the twenty-fourth day of the ninth month, in the second year of Darius, the LORD’s word came by Haggai the prophet, saying,"
        },
        {
          "verse": 11,
          "text": "“The LORD of Armies says: Ask now the priests concerning the law, saying,"
        },
        {
          "verse": 12,
          "text": "‘If someone carries holy meat in the fold of his garment, and with his fold touches bread, stew, wine, oil, or any food, will it become holy?’” The priests answered, “No.”"
        },
        {
          "verse": 13,
          "text": "Then Haggai said, “If one who is unclean by reason of a dead body touches any of these, will it be unclean?” The priests answered, “It will be unclean.”"
        },
        {
          "verse": 14,
          "text": "Then Haggai answered, “‘So is this people, and so is this nation before me,’ says the LORD; ‘and so is every work of their hands. That which they offer there is unclean."
        },
        {
          "verse": 15,
          "text": "Now, please consider from this day and backward, before a stone was laid on a stone in the LORD’s temple."
        },
        {
          "verse": 16,
          "text": "Through all that time, when one came to a heap of twenty measures, there were only ten. When one came to the wine vat to draw out fifty, there were only twenty."
        },
        {
          "verse": 17,
          "text": "I struck you with blight, mildew, and hail in all the work of your hands; yet you didn’t turn to me,’ says the LORD."
        },
        {
          "verse": 18,
          "text": "‘Consider, please, from this day and backward, from the twenty-fourth day of the ninth month, since the day that the foundation of the LORD’s temple was laid, consider it."
        },
        {
          "verse": 19,
          "text": "Is the seed yet in the barn? Yes, the vine, the fig tree, the pomegranate, and the olive tree haven’t produced. From today I will bless you.’”"
        },
        {
          "verse": 20,
          "text": "The LORD’s word came the second time to Haggai in the twenty-fourth day of the month, saying,"
        },
        {
          "verse": 21,
          "text": "“Speak to Zerubbabel, governor of Judah, saying, ‘I will shake the heavens and the earth."
        },
        {
          "verse": 22,
          "text": "I will overthrow the throne of kingdoms. I will destroy the strength of the kingdoms of the nations. I will overthrow the chariots and those who ride in them. The horses and their riders will come down, everyone by the sword of his brother."
        },
        {
          "verse": 23,
          "text": "In that day, says the LORD of Armies, I will take you, Zerubbabel my servant, the son of Shealtiel,’ says the LORD, ‘and will make you like a signet ring, for I have chosen you,’ says the LORD of Armies.”"
        }
      ]
    }
  ]
}
