{
  "schema": "agent-safe-bible.book.v1",
  "translation": "BSB",
  "id": "OBA",
  "name": "Obadiah",
  "chapters": [
    {
      "chapter": 1,
      "verses": [
        {
          "verse": 1,
          "text": "This is the vision of Obadiah:\nThis is what the Lord GOD says about Edom—\nWe have heard a message from the LORD;\nan envoy has been sent among the nations\nto say, “Rise up,\nand let us go to battle against her!”—"
        },
        {
          "verse": 2,
          "text": "“Behold, I will make you small among the nations;\nyou will be deeply despised."
        },
        {
          "verse": 3,
          "text": "The pride of your heart has deceived you,\nO dwellers in the clefts of the rocks\nwhose habitation is the heights,\nwho say in your heart,\n‘Who can bring me down to the ground?’"
        },
        {
          "verse": 4,
          "text": "Though you soar like the eagle\nand make your nest among the stars,\neven from there I will bring you down,”declares the LORD."
        },
        {
          "verse": 5,
          "text": "“If thieves came to you,\nif robbers by night—\noh, how you will be ruined—\nwould they not steal only what they wanted?\nIf grape gatherers came to you,\nwould they not leave some gleanings?"
        },
        {
          "verse": 6,
          "text": "But how Esau will be pillaged,\nhis hidden treasures sought out!"
        },
        {
          "verse": 7,
          "text": "All the men allied with you\nwill drive you to the border;\nthe men at peace with you\nwill deceive and overpower you.\nThose who eat your bread\nwill set a trap for you\nwithout your awareness of it."
        },
        {
          "verse": 8,
          "text": "In that day, declares the LORD,\nwill I not destroy the wise men of Edom\nand the men of understanding\nin the mountains of Esau?"
        },
        {
          "verse": 9,
          "text": "Then your mighty men, O Teman,\nwill be terrified,\nso that everyone in the mountains of Esau\nwill be cut down in the slaughter."
        },
        {
          "verse": 10,
          "text": "Because of the violence against your brother Jacob,\nyou will be covered with shame\nand cut off forever."
        },
        {
          "verse": 11,
          "text": "On the day you stood aloof\nwhile strangers carried off his wealth\nand foreigners entered his gate\nand cast lots for Jerusalem,\nyou were just like one of them."
        },
        {
          "verse": 12,
          "text": "But you should not gloat in that day,\nyour brother’s day of misfortune,\nnor rejoice over the people of Judah\nin the day of their destruction,\nnor boast proudly\nin the day of their distress."
        },
        {
          "verse": 13,
          "text": "You should not enter the gate of My people\nin the day of their disaster,\nnor gloat over their affliction\nin the day of their disaster,\nnor loot their wealth\nin the day of their disaster."
        },
        {
          "verse": 14,
          "text": "Nor should you stand at the crossroads\nto cut off their fugitives,\nnor deliver up their survivors\nin the day of their distress."
        },
        {
          "verse": 15,
          "text": "For the Day of the LORD is near\nfor all the nations.\nAs you have done, it will be done to you;\nyour recompense will return upon your own head."
        },
        {
          "verse": 16,
          "text": "For as you drank on My holy mountain,\nso all the nations will drink continually.\nThey will drink and gulp it down;\nthey will be as if they had never existed."
        },
        {
          "verse": 17,
          "text": "But on Mount Zion there will be deliverance,\nand it will be holy,\nand the house of Jacob\nwill reclaim their possession."
        },
        {
          "verse": 18,
          "text": "Then the house of Jacob will be a blazing fire,\nand the house of Joseph a burning flame;\nbut the house of Esau will be stubble—\nJacob will set it ablaze and consume it.\nTherefore no survivor will remain\nfrom the house of Esau.”For the LORD has spoken."
        },
        {
          "verse": 19,
          "text": "Those from the Negev will possess the mountains of Esau;\nthose from the foothills\nwill possess the land of the Philistines.\nThey will occupy the fields of Ephraim and Samaria,\nand Benjamin will possess Gilead."
        },
        {
          "verse": 20,
          "text": "And the exiles of this host of the Israelites\nwill possess the land of the Canaanites as far as Zarephath;\nand the exiles from Jerusalem who are in Sepharad\nwill possess the cities of the Negev."
        },
        {
          "verse": 21,
          "text": "The deliverers will ascend\nMount Zion\nto rule over the mountains of Esau.\nAnd the kingdom will belong to the LORD."
        }
      ]
    }
  ]
}
