{
  "schema": "agent-safe-bible.book.v1",
  "translation": "BSB",
  "id": "HAG",
  "name": "Haggai",
  "chapters": [
    {
      "chapter": 1,
      "verses": [
        {
          "verse": 1,
          "text": "In the second year of the reign of Darius, on the first day of the sixth month, the word of the LORD came through Haggai the prophet to Zerubbabel son of Shealtiel, governor of Judah, and to Joshua son of Jehozadak, the high priest, stating"
        },
        {
          "verse": 2,
          "text": "that this is what the LORD of Hosts says:\n“These people say, ‘The time has not yet come\nto rebuild the house of the LORD.’”"
        },
        {
          "verse": 3,
          "text": "Then the word of the LORD came through Haggai the prophet, saying:"
        },
        {
          "verse": 4,
          "text": "“Is it a time for you yourselves\nto live in your paneled houses,\nwhile this house lies in ruins?”"
        },
        {
          "verse": 5,
          "text": "Now this is what the LORD of Hosts says:\n“Consider carefully your ways."
        },
        {
          "verse": 6,
          "text": "You have planted much\nbut harvested little.\nYou eat but never have enough.\nYou drink but never have your fill.\nYou put on clothes but never get warm.\nYou earn wages to put into a bag pierced through.”"
        },
        {
          "verse": 7,
          "text": "This is what the LORD of Hosts says:\n“Consider carefully your ways."
        },
        {
          "verse": 8,
          "text": "Go up into the hills,\nbring down lumber, and build the house,\nso that I may take pleasure in it and be glorified,\nsays the LORD."
        },
        {
          "verse": 9,
          "text": "You expected much,\nbut behold, it amounted to little.\nAnd what you brought home, I blew away.\nWhy? declares the LORD of Hosts.\nBecause My house still lies in ruins,\nwhile each of you is busy\nwith his own house."
        },
        {
          "verse": 10,
          "text": "Therefore, on account of you\nthe heavens have withheld their dew\nand the earth has withheld its crops."
        },
        {
          "verse": 11,
          "text": "I have summoned a drought\non the fields and on the mountains,\non the grain, new wine, and oil,\nand on whatever the ground yields,\non man and beast,\nand on all the labor of your hands.”"
        },
        {
          "verse": 12,
          "text": "Then Zerubbabel son of Shealtiel and Joshua son of Jehozadak, the high priest, as well as all the remnant of the people, obeyed the voice of the LORD their God and the words of the prophet Haggai, because the LORD their God had sent him. So the people feared the LORD."
        },
        {
          "verse": 13,
          "text": "Haggai, the messenger of the LORD, delivered the message of the LORD to the people:\n“I am with you,”\ndeclares the LORD."
        },
        {
          "verse": 14,
          "text": "So the LORD stirred the spirit of Zerubbabel son of Shealtiel, governor of Judah, and the spirit of Joshua son of Jehozadak, the high priest, as well as the spirit of all the remnant of the people. And they came and began the work on the house of the LORD of Hosts, their God,"
        },
        {
          "verse": 15,
          "text": "on the twenty-fourth day of the sixth month, in the second year of King Darius."
        }
      ]
    },
    {
      "chapter": 2,
      "verses": [
        {
          "verse": 1,
          "text": "On the twenty-first day of the seventh month, the word of the LORD came through Haggai the prophet, saying:"
        },
        {
          "verse": 2,
          "text": "“Speak to Zerubbabel son of Shealtiel, governor of Judah, and to Joshua son of Jehozadak, the high priest, and also to the remnant of the people. Ask them,"
        },
        {
          "verse": 3,
          "text": "‘Who is left among you who saw this house in its former glory? How does it look to you now? Does it not appear to you like nothing in comparison?’"
        },
        {
          "verse": 4,
          "text": "But now be strong, O Zerubbabel,\ndeclares the LORD.\nBe strong, O Joshua son of Jehozadak,\nthe high priest.\nAnd be strong, all you people of the land,\ndeclares the LORD.\nWork! For I am with you,\ndeclares the LORD of Hosts."
        },
        {
          "verse": 5,
          "text": "This is the promise I made to you\nwhen you came out of Egypt.\nAnd My Spirit remains among you;\ndo not be afraid.”"
        },
        {
          "verse": 6,
          "text": "For this is what the LORD of Hosts says:\n“Once more, in a little while,\nI will shake the heavens and the earth,\nthe sea and the dry land."
        },
        {
          "verse": 7,
          "text": "I will shake all the nations,\nand they will come with all their treasures,\nand I will fill this house with glory,\nsays the LORD of Hosts."
        },
        {
          "verse": 8,
          "text": "The silver is Mine, and the gold is Mine,\ndeclares the LORD of Hosts."
        },
        {
          "verse": 9,
          "text": "The latter glory of this house\nwill be greater than the former,\nsays the LORD of Hosts.\nAnd in this place I will provide peace,\ndeclares the LORD of Hosts.”"
        },
        {
          "verse": 10,
          "text": "On the twenty-fourth day of the ninth month, in the second year of Darius, the word of the LORD came to Haggai the prophet, saying,"
        },
        {
          "verse": 11,
          "text": "“This is what the LORD of Hosts says: ‘Ask the priests for a ruling."
        },
        {
          "verse": 12,
          "text": "If a man carries consecrated meat in the fold of his garment, and it touches bread, stew, wine, oil, or any other food, does that item become holy?’”\n“No,” replied the priests."
        },
        {
          "verse": 13,
          "text": "So Haggai asked, “If one who is defiled by contact with a corpse touches any of these, does it become defiled?”\n“Yes, it becomes defiled,” the priests answered."
        },
        {
          "verse": 14,
          "text": "Then Haggai replied, “So it is with this people and this nation before Me, declares the LORD, and so it is with every work of their hands; whatever they offer there is defiled."
        },
        {
          "verse": 15,
          "text": "Now consider carefully from this day forward: Before one stone was placed on another in the temple of the LORD,"
        },
        {
          "verse": 16,
          "text": "from that time, when one came expecting a heap of twenty ephahs of grain, there were but ten. When one came to the winepress to draw out fifty baths, there were but twenty."
        },
        {
          "verse": 17,
          "text": "I struck you—all the work of your hands—with blight, mildew, and hail, but you did not turn to Me, declares the LORD."
        },
        {
          "verse": 18,
          "text": "Consider carefully from this day forward—from the twenty-fourth day of the ninth month, the day the foundation of the LORD’s temple was laid—consider carefully:"
        },
        {
          "verse": 19,
          "text": "Is there still seed in the barn? The vine, the fig, the pomegranate, and the olive tree have not yet yielded fruit. But from this day on, I will bless you.”"
        },
        {
          "verse": 20,
          "text": "For the second time that day, the twenty-fourth day of the month, the word of the LORD came to Haggai, saying,"
        },
        {
          "verse": 21,
          "text": "“Tell Zerubbabel governor of Judah that I am about to shake the heavens and the earth:"
        },
        {
          "verse": 22,
          "text": "I will overturn royal thrones\nand destroy the power\nof the kingdoms of the nations.\nI will overturn chariots and their riders;\nhorses and their riders will fall,\neach by the sword of his brother."
        },
        {
          "verse": 23,
          "text": "On that day,\ndeclares the LORD of Hosts,\nI will take you, My servant,\nZerubbabel son of Shealtiel,\ndeclares the LORD,\nand I will make you like My signet ring,\nfor I have chosen you,\ndeclares the LORD of Hosts.”"
        }
      ]
    }
  ]
}
