{
  "schema": "agent-safe-bible.book.v1",
  "translation": "BSB",
  "id": "TIT",
  "name": "Titus",
  "chapters": [
    {
      "chapter": 1,
      "verses": [
        {
          "verse": 1,
          "text": "Paul, a servant of God and an apostle of Jesus Christ for the faith of God’s elect and their knowledge of the truth that leads to godliness,"
        },
        {
          "verse": 2,
          "text": "in the hope of eternal life, which God, who cannot lie, promised before time began."
        },
        {
          "verse": 3,
          "text": "In His own time He has made His word evident in the proclamation entrusted to me by the command of God our Savior."
        },
        {
          "verse": 4,
          "text": "To Titus, my true child in our common faith:\nGrace and peace from God the Father and Christ Jesus our Savior."
        },
        {
          "verse": 5,
          "text": "The reason I left you in Crete was that you would set in order what was unfinished and appoint elders in every town, as I directed you."
        },
        {
          "verse": 6,
          "text": "An elder must be blameless, the husband of but one wife, having children who are believers and who are not open to accusation of indiscretion or insubordination."
        },
        {
          "verse": 7,
          "text": "As God’s steward, an overseer must be above reproach—not self-willed, not quick-tempered, not given to drunkenness, not violent, not greedy for money."
        },
        {
          "verse": 8,
          "text": "Instead, he must be hospitable, a lover of good, self-controlled, upright, holy, and disciplined."
        },
        {
          "verse": 9,
          "text": "He must hold firmly to the faithful word as it was taught, so that he can encourage others by sound teaching and refute those who contradict it."
        },
        {
          "verse": 10,
          "text": "For many are rebellious and full of empty talk and deception, especially those of the circumcision,"
        },
        {
          "verse": 11,
          "text": "who must be silenced. For the sake of dishonorable gain, they undermine entire households and teach things they should not."
        },
        {
          "verse": 12,
          "text": "As one of their own prophets has said, “Cretans are always liars, evil beasts, lazy gluttons.”"
        },
        {
          "verse": 13,
          "text": "This testimony is true. Therefore rebuke them sternly, so that they will be sound in the faith"
        },
        {
          "verse": 14,
          "text": "and will pay no attention to Jewish myths or to the commands of men who have rejected the truth."
        },
        {
          "verse": 15,
          "text": "To the pure, all things are pure; but to the defiled and unbelieving, nothing is pure. Indeed, both their minds and their consciences are defiled."
        },
        {
          "verse": 16,
          "text": "They profess to know God, but by their actions they deny Him. They are detestable, disobedient, and unfit for any good deed."
        }
      ]
    },
    {
      "chapter": 2,
      "verses": [
        {
          "verse": 1,
          "text": "But as for you, speak the things that are consistent with sound doctrine."
        },
        {
          "verse": 2,
          "text": "Older men are to be temperate, dignified, self-controlled, and sound in faith, love, and perseverance."
        },
        {
          "verse": 3,
          "text": "Older women, likewise, are to be reverent in their behavior, not slanderers or addicted to much wine, but teachers of good."
        },
        {
          "verse": 4,
          "text": "In this way they can train the young women to love their husbands and children,"
        },
        {
          "verse": 5,
          "text": "to be self-controlled, pure, managers of their households, kind, and submissive to their own husbands, so that the word of God will not be discredited."
        },
        {
          "verse": 6,
          "text": "In the same way, urge the younger men to be self-controlled."
        },
        {
          "verse": 7,
          "text": "In everything, show yourself to be an example by doing good works. In your teaching show integrity, dignity,"
        },
        {
          "verse": 8,
          "text": "and wholesome speech that is above reproach, so that anyone who opposes us will be ashamed, having nothing bad to say about us."
        },
        {
          "verse": 9,
          "text": "Slaves are to submit to their own masters in everything, to be well-pleasing, not argumentative,"
        },
        {
          "verse": 10,
          "text": "not stealing from them, but showing all good faith, so that in every respect they will adorn the teaching about God our Savior."
        },
        {
          "verse": 11,
          "text": "For the grace of God has appeared, bringing salvation to everyone."
        },
        {
          "verse": 12,
          "text": "It instructs us to renounce ungodliness and worldly passions, and to live sensible, upright, and godly lives in the present age,"
        },
        {
          "verse": 13,
          "text": "as we await the blessed hope and glorious appearance of our great God and Savior Jesus Christ."
        },
        {
          "verse": 14,
          "text": "He gave Himself for us to redeem us from all lawlessness and to purify for Himself a people for His own possession, zealous for good deeds."
        },
        {
          "verse": 15,
          "text": "Speak these things as you encourage and rebuke with all authority. Let no one despise you."
        }
      ]
    },
    {
      "chapter": 3,
      "verses": [
        {
          "verse": 1,
          "text": "Remind the believers to submit to rulers and authorities, to be obedient and ready for every good work,"
        },
        {
          "verse": 2,
          "text": "to malign no one, and to be peaceable and gentle, showing full consideration to everyone."
        },
        {
          "verse": 3,
          "text": "For at one time we too were foolish, disobedient, misled, and enslaved to all sorts of desires and pleasures—living in malice and envy, being hated and hating one another."
        },
        {
          "verse": 4,
          "text": "But when the kindness of God our Savior and His love for mankind appeared,"
        },
        {
          "verse": 5,
          "text": "He saved us, not by the righteous deeds we had done, but according to His mercy, through the washing of new birth and renewal by the Holy Spirit."
        },
        {
          "verse": 6,
          "text": "This is the Spirit He poured out on us abundantly through Jesus Christ our Savior,"
        },
        {
          "verse": 7,
          "text": "so that, having been justified by His grace, we would become heirs with the hope of eternal life."
        },
        {
          "verse": 8,
          "text": "This saying is trustworthy. And I want you to emphasize these things, so that those who have believed God will take care to devote themselves to good deeds. These things are excellent and profitable for the people."
        },
        {
          "verse": 9,
          "text": "But avoid foolish controversies, genealogies, arguments, and quarrels about the law, because these things are pointless and worthless."
        },
        {
          "verse": 10,
          "text": "Reject a divisive man after a first and second admonition,"
        },
        {
          "verse": 11,
          "text": "knowing that such a man is corrupt and sinful; he is self-condemned."
        },
        {
          "verse": 12,
          "text": "As soon as I send Artemas or Tychicus to you, make every effort to come to me at Nicopolis, because I have decided to winter there."
        },
        {
          "verse": 13,
          "text": "Do your best to equip Zenas the lawyer and Apollos, so that they will have everything they need."
        },
        {
          "verse": 14,
          "text": "And our people must also learn to devote themselves to good works in order to meet the pressing needs of others, so that they will not be unfruitful."
        },
        {
          "verse": 15,
          "text": "All who are with me send you greetings.\nGreet those who love us in the faith.\nGrace be with all of you."
        }
      ]
    }
  ]
}
