{
  "schema": "agent-safe-bible.book.v1",
  "translation": "WEB",
  "id": "JON",
  "name": "Jonah",
  "chapters": [
    {
      "chapter": 1,
      "verses": [
        {
          "verse": 1,
          "text": "Now the LORD’s word came to Jonah the son of Amittai, saying,"
        },
        {
          "verse": 2,
          "text": "“Arise, go to Nineveh, that great city, and preach against it, for their wickedness has come up before me.”"
        },
        {
          "verse": 3,
          "text": "But Jonah rose up to flee to Tarshish from the presence of the LORD. He went down to Joppa, and found a ship going to Tarshish; so he paid its fare, and went down into it, to go with them to Tarshish from the presence of the LORD."
        },
        {
          "verse": 4,
          "text": "But the LORD sent out a great wind on the sea, and there was a mighty storm on the sea, so that the ship was likely to break up."
        },
        {
          "verse": 5,
          "text": "Then the mariners were afraid, and every man cried to his god. They threw the cargo that was in the ship into the sea to lighten the ship. But Jonah had gone down into the innermost parts of the ship and he was laying down, and was fast asleep."
        },
        {
          "verse": 6,
          "text": "So the ship master came to him, and said to him, “What do you mean, sleeper? Arise, call on your God! Maybe your God will notice us, so that we won’t perish.”"
        },
        {
          "verse": 7,
          "text": "They all said to each other, “Come! Let’s cast lots, that we may know who is responsible for this evil that is on us.” So they cast lots, and the lot fell on Jonah."
        },
        {
          "verse": 8,
          "text": "Then they asked him, “Tell us, please, for whose cause this evil is on us. What is your occupation? Where do you come from? What is your country? Of what people are you?”"
        },
        {
          "verse": 9,
          "text": "He said to them, “I am a Hebrew, and I fear the LORD, the God of heaven, who has made the sea and the dry land.”"
        },
        {
          "verse": 10,
          "text": "Then the men were exceedingly afraid, and said to him, “What have you done?” For the men knew that he was fleeing from the presence of the LORD, because he had told them."
        },
        {
          "verse": 11,
          "text": "Then they said to him, “What shall we do to you, that the sea may be calm to us?” For the sea grew more and more stormy."
        },
        {
          "verse": 12,
          "text": "He said to them, “Take me up, and throw me into the sea. Then the sea will be calm for you; for I know that because of me this great storm is on you.”"
        },
        {
          "verse": 13,
          "text": "Nevertheless the men rowed hard to get them back to the land; but they could not, for the sea grew more and more stormy against them."
        },
        {
          "verse": 14,
          "text": "Therefore they cried to the LORD, and said, “We beg you, LORD, we beg you, don’t let us die for this man’s life, and don’t lay on us innocent blood; for you, LORD, have done as it pleased you.”"
        },
        {
          "verse": 15,
          "text": "So they took up Jonah and threw him into the sea; and the sea ceased its raging."
        },
        {
          "verse": 16,
          "text": "Then the men feared the LORD exceedingly; and they offered a sacrifice to the LORD and made vows."
        },
        {
          "verse": 17,
          "text": "The LORD prepared a huge fish to swallow up Jonah, and Jonah was in the belly of the fish three days and three nights."
        }
      ]
    },
    {
      "chapter": 2,
      "verses": [
        {
          "verse": 1,
          "text": "Then Jonah prayed to the LORD, his God, out of the fish’s belly."
        },
        {
          "verse": 2,
          "text": "He said,\n“I called because of my affliction to the LORD.\nHe answered me.\nOut of the belly of Sheol\nI cried.\nYou heard my voice."
        },
        {
          "verse": 3,
          "text": "For you threw me into the depths,\nin the heart of the seas.\nThe flood was all around me.\nAll your waves and your billows passed over me."
        },
        {
          "verse": 4,
          "text": "I said, ‘I have been banished from your sight;\nyet I will look again toward your holy temple.’"
        },
        {
          "verse": 5,
          "text": "The waters surrounded me,\neven to the soul.\nThe deep was around me.\nThe weeds were wrapped around my head."
        },
        {
          "verse": 6,
          "text": "I went down to the bottoms of the mountains.\nThe earth barred me in forever;\nyet you have brought my life up from the pit, LORD my God."
        },
        {
          "verse": 7,
          "text": "“When my soul fainted within me, I remembered the LORD.\nMy prayer came in to you, into your holy temple."
        },
        {
          "verse": 8,
          "text": "Those who regard vain idols forsake their own mercy."
        },
        {
          "verse": 9,
          "text": "But I will sacrifice to you with the voice of thanksgiving.\nI will pay that which I have vowed.\nSalvation belongs to the LORD.”"
        },
        {
          "verse": 10,
          "text": "Then the LORD spoke to the fish, and it vomited out Jonah on the dry land."
        }
      ]
    },
    {
      "chapter": 3,
      "verses": [
        {
          "verse": 1,
          "text": "The LORD’s word came to Jonah the second time, saying,"
        },
        {
          "verse": 2,
          "text": "“Arise, go to Nineveh, that great city, and preach to it the message that I give you.”"
        },
        {
          "verse": 3,
          "text": "So Jonah arose, and went to Nineveh, according to the LORD’s word. Now Nineveh was an exceedingly great city, three days’ journey across."
        },
        {
          "verse": 4,
          "text": "Jonah began to enter into the city a day’s journey, and he cried out, and said, “In forty days, Nineveh will be overthrown!”"
        },
        {
          "verse": 5,
          "text": "The people of Nineveh believed God; and they proclaimed a fast and put on sackcloth, from their greatest even to their least."
        },
        {
          "verse": 6,
          "text": "The news reached the king of Nineveh, and he arose from his throne, took off his royal robe, covered himself with sackcloth, and sat in ashes."
        },
        {
          "verse": 7,
          "text": "He made a proclamation and published through Nineveh by the decree of the king and his nobles, saying, “Let neither man nor animal, herd nor flock, taste anything; let them not feed, nor drink water;"
        },
        {
          "verse": 8,
          "text": "but let them be covered with sackcloth, both man and animal, and let them cry mightily to God. Yes, let them turn everyone from his evil way and from the violence that is in his hands."
        },
        {
          "verse": 9,
          "text": "Who knows whether God will not turn and relent, and turn away from his fierce anger, so that we might not perish?”"
        },
        {
          "verse": 10,
          "text": "God saw their works, that they turned from their evil way. God relented of the disaster which he said he would do to them, and he didn’t do it."
        }
      ]
    },
    {
      "chapter": 4,
      "verses": [
        {
          "verse": 1,
          "text": "But it displeased Jonah exceedingly, and he was angry."
        },
        {
          "verse": 2,
          "text": "He prayed to the LORD, and said, “Please, LORD, wasn’t this what I said when I was still in my own country? Therefore I hurried to flee to Tarshish, for I knew that you are a gracious God and merciful, slow to anger, and abundant in loving kindness, and you relent of doing harm."
        },
        {
          "verse": 3,
          "text": "Therefore now, LORD, take, I beg you, my life from me, for it is better for me to die than to live.”"
        },
        {
          "verse": 4,
          "text": "The LORD said, “Is it right for you to be angry?”"
        },
        {
          "verse": 5,
          "text": "Then Jonah went out of the city and sat on the east side of the city, and there made himself a booth and sat under it in the shade, until he might see what would become of the city."
        },
        {
          "verse": 6,
          "text": "The LORD God prepared a vine and made it to come up over Jonah, that it might be a shade over his head to deliver him from his discomfort. So Jonah was exceedingly glad because of the vine."
        },
        {
          "verse": 7,
          "text": "But God prepared a worm at dawn the next day, and it chewed on the vine so that it withered."
        },
        {
          "verse": 8,
          "text": "When the sun arose, God prepared a sultry east wind; and the sun beat on Jonah’s head, so that he was faint and requested for himself that he might die. He said, “It is better for me to die than to live.”"
        },
        {
          "verse": 9,
          "text": "God said to Jonah, “Is it right for you to be angry about the vine?” He said, “I am right to be angry, even to death.”"
        },
        {
          "verse": 10,
          "text": "The LORD said, “You have been concerned for the vine, for which you have not labored, neither made it grow; which came up in a night and perished in a night."
        },
        {
          "verse": 11,
          "text": "Shouldn’t I be concerned for Nineveh, that great city, in which are more than one hundred twenty thousand persons who can’t discern between their right hand and their left hand, and also many animals?”"
        }
      ]
    }
  ]
}
