{
  "schema": "agent-safe-bible.book.v1",
  "translation": "WEB",
  "id": "2TH",
  "name": "2 Thessalonians",
  "chapters": [
    {
      "chapter": 1,
      "verses": [
        {
          "verse": 1,
          "text": "Paul, Silvanus, and Timothy, to the assembly of the Thessalonians in God our Father and the Lord Jesus Christ:"
        },
        {
          "verse": 2,
          "text": "Grace to you and peace from God our Father and the Lord Jesus Christ."
        },
        {
          "verse": 3,
          "text": "We are bound to always give thanks to God for you, brothers, even as it is appropriate, because your faith grows exceedingly, and the love of each and every one of you toward one another abounds,"
        },
        {
          "verse": 4,
          "text": "so that we ourselves boast about you in the assemblies of God for your perseverance and faith in all your persecutions and in the afflictions which you endure."
        },
        {
          "verse": 5,
          "text": "This is an obvious sign of the righteous judgment of God, to the end that you may be counted worthy of God’s Kingdom, for which you also suffer."
        },
        {
          "verse": 6,
          "text": "For it is a righteous thing with God to repay affliction to those who afflict you,"
        },
        {
          "verse": 7,
          "text": "and to give relief to you who are afflicted with us when the Lord Jesus is revealed from heaven with his mighty angels in flaming fire,"
        },
        {
          "verse": 8,
          "text": "punishing those who don’t know God, and to those who don’t obey the Good News of our Lord Jesus,"
        },
        {
          "verse": 9,
          "text": "who will pay the penalty: eternal destruction from the face of the Lord and from the glory of his might,"
        },
        {
          "verse": 10,
          "text": "when he comes in that day to be glorified in his saints and to be admired among all those who have believed, because our testimony to you was believed."
        },
        {
          "verse": 11,
          "text": "To this end we also pray always for you that our God may count you worthy of your calling, and fulfill every desire of goodness and work of faith with power,"
        },
        {
          "verse": 12,
          "text": "that the name of our Lord Jesus may be glorified in you, and you in him, according to the grace of our God and the Lord Jesus Christ."
        }
      ]
    },
    {
      "chapter": 2,
      "verses": [
        {
          "verse": 1,
          "text": "Now, brothers, concerning the coming of our Lord Jesus Christ and our gathering together to him, we ask you"
        },
        {
          "verse": 2,
          "text": "not to be quickly shaken in your mind or troubled, either by spirit or by word or by letter as if from us, saying that the day of Christ has already come."
        },
        {
          "verse": 3,
          "text": "Let no one deceive you in any way. For it will not be unless the rebellion comes first, and the man of sin is revealed, the son of destruction."
        },
        {
          "verse": 4,
          "text": "He opposes and exalts himself against all that is called God or that is worshiped, so that he sits as God in the temple of God, setting himself up as God."
        },
        {
          "verse": 5,
          "text": "Don’t you remember that when I was still with you, I told you these things?"
        },
        {
          "verse": 6,
          "text": "Now you know what is restraining him, to the end that he may be revealed in his own season."
        },
        {
          "verse": 7,
          "text": "For the mystery of lawlessness already works. Only there is one who restrains now, until he is taken out of the way."
        },
        {
          "verse": 8,
          "text": "Then the lawless one will be revealed, whom the Lord will kill with the breath of his mouth and destroy by the manifestation of his coming;"
        },
        {
          "verse": 9,
          "text": "even he whose coming is according to the working of Satan with all power and signs and lying wonders,"
        },
        {
          "verse": 10,
          "text": "and with all deception of wickedness for those who are being lost, because they didn’t receive the love of the truth, that they might be saved."
        },
        {
          "verse": 11,
          "text": "Because of this, God sends them a powerful delusion, that they should believe a lie,"
        },
        {
          "verse": 12,
          "text": "that they all might be judged who didn’t believe the truth, but had pleasure in unrighteousness."
        },
        {
          "verse": 13,
          "text": "But we are bound to always give thanks to God for you, brothers loved by the Lord, because God chose you from the beginning for salvation through sanctification of the Spirit and belief in the truth,"
        },
        {
          "verse": 14,
          "text": "to which he called you through our Good News, for the obtaining of the glory of our Lord Jesus Christ."
        },
        {
          "verse": 15,
          "text": "So then, brothers, stand firm and hold the traditions which you were taught by us, whether by word or by letter."
        },
        {
          "verse": 16,
          "text": "Now our Lord Jesus Christ himself, and God our Father, who loved us and gave us eternal comfort and good hope through grace,"
        },
        {
          "verse": 17,
          "text": "comfort your hearts and establish you in every good work and word."
        }
      ]
    },
    {
      "chapter": 3,
      "verses": [
        {
          "verse": 1,
          "text": "Finally, brothers, pray for us, that the word of the Lord may spread rapidly and be glorified, even as also with you,"
        },
        {
          "verse": 2,
          "text": "and that we may be delivered from unreasonable and evil men; for not all have faith."
        },
        {
          "verse": 3,
          "text": "But the Lord is faithful, who will establish you and guard you from the evil one."
        },
        {
          "verse": 4,
          "text": "We have confidence in the Lord concerning you, that you both do and will do the things we command."
        },
        {
          "verse": 5,
          "text": "May the Lord direct your hearts into God’s love and into the perseverance of Christ."
        },
        {
          "verse": 6,
          "text": "Now we command you, brothers, in the name of our Lord Jesus Christ, that you withdraw yourselves from every brother who walks in rebellion and not after the tradition which they received from us."
        },
        {
          "verse": 7,
          "text": "For you know how you ought to imitate us. For we didn’t behave ourselves rebelliously among you,"
        },
        {
          "verse": 8,
          "text": "neither did we eat bread from anyone’s hand without paying for it, but in labor and travail worked night and day, that we might not burden any of you."
        },
        {
          "verse": 9,
          "text": "This was not because we don’t have the right, but to make ourselves an example to you, that you should imitate us."
        },
        {
          "verse": 10,
          "text": "For even when we were with you, we commanded you this: “If anyone is not willing to work, don’t let him eat.”"
        },
        {
          "verse": 11,
          "text": "For we hear of some who walk among you in rebellion, who don’t work at all, but are busybodies."
        },
        {
          "verse": 12,
          "text": "Now those who are that way, we command and exhort in the Lord Jesus Christ, that they work with quietness and eat their own bread."
        },
        {
          "verse": 13,
          "text": "But you, brothers, don’t be weary in doing what is right."
        },
        {
          "verse": 14,
          "text": "If any man doesn’t obey our word in this letter, note that man and have no company with him, to the end that he may be ashamed."
        },
        {
          "verse": 15,
          "text": "Don’t count him as an enemy, but admonish him as a brother."
        },
        {
          "verse": 16,
          "text": "Now may the Lord of peace himself give you peace at all times in all ways. The Lord be with you all."
        },
        {
          "verse": 17,
          "text": "I, Paul, write this greeting with my own hand, which is the sign in every letter. This is how I write."
        },
        {
          "verse": 18,
          "text": "The grace of our Lord Jesus Christ be with you all. Amen."
        }
      ]
    }
  ]
}
